,Time,Sender,SenderID,Message
0,2023-01-08 13:40:39,星海旅人·阿尔法,1685234947,[图片]
1,2023-01-08 13:44:48,.,2273522677,[图片]
2,2023-01-08 13:45:08,.,2273522677,大概是这样罢
3,2023-01-08 13:45:20,宇宙尘埃·贝塔,3927164830,这张图片好像见过
4,2023-01-08 13:45:35,漫天繁星·伽马,7283910291,哪儿见过？
5,2023-01-08 13:46:00,宇宙尘埃·贝塔,3927164830,我也不记得了，就是感觉很熟悉
6,2023-01-08 13:46:19,.,2273522677,可能在哪个网站看到过
7,2023-01-08 13:46:35,星海旅人·阿尔法,1685234947,[图片]
8,2023-01-08 13:47:00,星辰破碎·德尔塔,1287934610,哈哈，这个好笑
9,2023-01-08 13:47:25,宇宙尘埃·贝塔,3927164830,我喜欢这个
10,2023-01-08 13:47:45,.,2273522677,这个确实有趣
11,2023-01-08 13:48:35,星辰破碎·德尔塔,1287934610,哇，这是哪里拍的？
12,2023-01-08 13:49:00,宇宙尘埃·贝塔,3927164830,看起来像是海边
13,2023-01-08 13:49:25,.,2273522677,我觉得应该是山区
14,2023-01-08 13:49:50,星海旅人·阿尔法,1685234947,哈哈，你们都猜错了，这其实是我家附近的公园
15,2023-01-08 13:50:15,漫天繁星·伽马,7283910291,哇，你家附近的公园真美
16,2023-01-08 13:50:40,宇宙尘埃·贝塔,3927164830,真的很美，我也想去看看
17,2023-01-08 13:51:05,.,2273522677,我也想去
18,2023-01-08 13:51:30,星辰破碎·德尔塔,1287934610,那我们约个时间一起去？
19,2023-01-08 13:51:55,星海旅人·阿尔法,1685234947,好啊，我们可以周末去
20,2023-01-08 13:52:20,漫天繁星·伽马,7283910291,我这周末有空
21,2023-01-08 13:52:45,宇宙尘埃·贝塔,3927164830,我也有空
22,2023-01-08 13:53:10,.,2273522677,我可能要工作，看情况
23,2023-01-08 13:53:35,星海旅人·阿尔法,1685234947,那我们先这么定吧
24,2023-01-08 13:54:00,星辰破碎·德尔塔,1287934610,好的，那我们周末见
25,2023-01-08 13:54:25,宇宙尘埃·贝塔,3927164830,期待周末的到来
26,2023-01-08 13:54:50,漫天繁星·伽马,7283910291,我也很期待
27,2023-01-08 13:55:15,.,2273522677,我会尽量调整工作的
28,2023-01-08 13:55:40,星海旅人·阿尔法,1685234947,好的，期待你的参加
29,2023-01-08 13:56:05,星辰破碎·德尔塔,1287934610,我们到时候可以野餐
30,2023-01-08 13:56:30,宇宙尘埃·贝塔,3927164830,好主意！
31,2023-01-08 13:56:55,漫天繁星·伽马,7283910291,我可以准备食物
32,2023-01-08 13:57:20,.,2273522677,我可以带一些游戏
33,2023-01-08 13:57:45,星海旅人·阿尔法,1685234947,听起来很有趣，我可以带一些饮料
34,2023-01-08 13:58:10,星辰破碎·德尔塔,1287934610,那我们就这么定了
35,2023-01-08 13:58:35,宇宙尘埃·贝塔,3927164830,好的，期待周末的到来
36,2023-01-08 13:59:00,漫天繁星·伽马,7283910291,同期待
37,2023-01-08 13:59:25,.,2273522677,期待我们的聚会
38,2023-01-08 14:00:00,星海旅人·阿尔法,1685234947,那我们现在来聊聊经济学的问题吧，我相信大家都有自己的看法。
39,2023-01-08 14:00:25,星辰破碎·德尔塔,1287934610,我个人更倾向于计划经济，我觉得经济是需要通过中央计划来调控的。
40,2023-01-08 14:00:50,漫天繁星·伽马,7283910291,我不同意。我觉得自由市场的力量是最有效的，市场的供需关系是自我调节的。
41,2023-01-08 14:01:15,宇宙尘埃·贝塔,3927164830,我个人更喜欢混合经济，既有计划经济的部分，也有市场经济的部分。
42,2023-01-08 14:01:40,星海旅人·阿尔法,1685234947,我也赞同混合经济的观点。计划经济和市场经济各有优点，如果能很好地结合起来，效果可能会更好。
43,2023-01-08 14:02:05,星辰破碎·德尔塔,1287934610,漫天繁星·伽马，你说自由市场是自我调节的，但是我们可以看到，在金融危机中，自由市场经济的短板就体现出来了。
44,2023-01-08 14:02:30,漫天繁星·伽马,7283910291,星辰破碎·德尔塔，你说的没错，但金融危机也反映出了计划经济的问题。比如在金融危机中，政府往往过度干预，反而加剧了市场的波动。
45,2023-01-08 14:02:55,宇宙尘埃·贝塔,3927164830,我觉得，无论是计划经济还是市场经济，关键是看如何更好地服务社会，而不仅仅是追求经济增长。
46,2023-01-08 14:03:20,星海旅人·阿尔法,1685234947,宇宙尘埃·贝塔说得很有道理。我们应该寻求的是平衡，而不是偏向一个极端。
47,2023-01-08 14:03:45,星辰破碎·德尔塔,1287934610,我同意，无论是计划经济还是市场经济，都需要结合实际情况来进行调整和优化。
48,2023-01-08 14:04:10,漫天繁星·伽马,7283910291,确实，我们需要在理论和实践中寻找最佳的平衡点。
49,2023-01-08 14:04:35,宇宙尘埃·贝塔,3927164830,我们都有很好的观点，这次讨论真的很有意义。
50,2023-01-08 14:05:00,星海旅人·阿尔法,1685234947,我也觉得，这次的讨论让我学到了很多。
51,2023-01-08 14:20:00,星海旅人·阿尔法,1685234947,接下来我们讨论一个很有趣的问题：甜粽子和咸粽子，谁更能代表粽子？
52,2023-01-08 14:20:45,星辰破碎·德尔塔,1287934610,我认为咸粽子更能代表粽子，它更具有传统文化的特色。
53,2023-01-08 14:21:15,漫天繁星·伽马,7283910291,我不同意。我觉得甜粽子更能代表粽子，甜粽子的味道更符合现代人的口味。
54,2023-01-08 14:21:50,宇宙尘埃·贝塔,3927164830,我个人更喜欢甜粽子，但我觉得咸粽子在传统文化中的地位无可替代。
55,2023-01-08 14:22:20,星海旅人·阿尔法,1685234947,我们可以从食材和制作工艺等方面考虑。比如，咸粽子的材料一般是猪肉、咸蛋等，具有独特的口感，而甜粽子则以豆沙、红枣等为主，口感更为甜蜜。
56,2023-01-08 14:23:00,星辰破碎·德尔塔,1287934610,这么说来，咸粽子在材料和工艺上更复杂，需要更高的技艺，这也证明了它更具代表性。
57,2023-01-08 14:23:35,漫天繁星·伽马,7283910291,但甜粽子的口感和甜蜜的味道更符合大众的喜好，这也是一种代表性。
58,2023-01-08 14:24:10,宇宙尘埃·贝塔,3927164830,我觉得，无论是甜粽子还是咸粽子，它们都代表了粽子的不同方面，都有各自的价值。
59,2023-01-08 14:24:45,星海旅人·阿尔法,1685234947,我同意。其实，甜粽子和咸粽子的争论可能就像我们之前讨论的经济问题一样，需要根据具体情况和口味来选择，而不是一刀切。
60,2023-01-08 14:25:20,星辰破碎·德尔塔,1287934610,这的确是一个很有趣的比较。我们都有自己的观点，这是值得尊重的。
61,2023-01-08 14:25:55,漫天繁星·伽马,7283910291,确实，每个人的口味都是独一无二的，这也是我们讨论这个问题的乐趣所在。
62,2023-01-08 14:26:30,宇宙尘埃·贝塔,3927164830,总的来说，我觉得甜粽子和咸粽子都是粽子的重要代表，它们各有特色，都很美味。
